{
  "id": "I.thm.popcount32",
  "kind": "theorem",
  "part": 1,
  "title": "Hacker's Delight popcount (Fig. 5-2) computes the bit count",
  "statement": "Warren's five-step SWAR population count equals the 32-term bit-sum specification for every 32-bit word. This is the worked example in the Lean 4 reference manual (proved there by bv_decide) and the first identity in Bhat et al.'s 100%-of-Hacker's-Delight width-independent result; here it is decided by axeyum's front door.",
  "formal": {
    "language": "smt-lib",
    "statement": "(forall ((x (_ BitVec 32))) (= hd(x) (bvadd (bit 0) ... (bit 31))))",
    "fragment": "QF_BV"
  },
  "scope": "width 32, fixed",
  "epistemic_status": "proved",
  "external_status": "proved",
  "depends_on": [
    "W.def.word"
  ],
  "evidence": [
    {
      "kind": "front-door-verdict",
      "artifact": "artifacts/words/popcount-hd-fig5-2-equals-spec.smt2",
      "checker_command": "scripts/check_smt.sh artifacts/words/popcount-hd-fig5-2-equals-spec.smt2 unsat",
      "check_status": "checked",
      "checked_on": "2026-08-27"
    }
  ],
  "axeyum": {
    "example": "smtcomp_cli",
    "reconstruction": "TheoryReconstruction"
  },
  "book": {
    "chapter": "ch02-instructions-as-functions",
    "label": "thm:popcount"
  },
  "sources": [
    "Warren, Hacker's Delight 2e, Fig. 5-2 p.82",
    "lean-lang.org/doc/reference/latest/Basic-Types/Bitvectors/",
    "Bhat, Stefanesco, Hughes, Grosser, OOPSLA 2025, doi:10.1145/3763148"
  ],
  "provenance": {
    "date": "2026-08-27",
    "by": "isa-calculus bootstrap (Claude Code session with axeyum)",
    "origin": "see research/"
  }
}
