{
  "id": "OP.avx2.perfectshuffle-certify",
  "kind": "open-problem",
  "part": 5,
  "title": "Certify or refute LLVM's shipped AArch64PerfectShuffle table",
  "statement": "~6,561 4-lane NEON shuffle entries generated by a fixpoint over a hand-picked operator set with a non-additive cost model; no certificate; possibly wrong. ~300 vars per entry, embarrassingly parallel. Effort estimate: weeks.",
  "formal": {
    "language": "prose",
    "statement": "see statement"
  },
  "epistemic_status": "open",
  "external_status": "computed-uncertified",
  "evidence": [],
  "sources": [
    "research/surveys/ -- see the per-domain reports for citations and encoding estimates"
  ],
  "provenance": {
    "date": "2026-08-27",
    "by": "isa-calculus bootstrap (Claude Code session with axeyum)",
    "origin": "see research/"
  }
}
